{
  "device": "mzi_cascade",
  "platform": "sin",
  "wavelength_nm": 1550,
  "stages": [
    {"name": "first", "delta_length_um": 0, "phase_control": {"phase_rad": 1.5707963267948966, "active_length_um": 100}},
    {"name": "second", "delta_length_um": 0, "phase_control": {"phase_rad": 3.141592653589793, "active_length_um": 150}}
  ],
  "link_length_um": 100,
  "outputs": ["netlist", "simulation", "gds", "verification"]
}
